{
  "schemaVersion": "independent-review-policy.v2",
  "policyId": "independent-review-policy-v2",
  "policyVersion": "2.0.0",
  "lifecycle": "ACTIVE",
  "assuranceLevel": "MODEL_ONLY_PREPRODUCTION",
  "applicablePhases": [
    "P0",
    "P1",
    "P2"
  ],
  "dataBoundary": "SYNTHETIC_ONLY",
  "humanIndependentReviewRequired": false,
  "humanIndependentReviewSatisfied": false,
  "independentModelReviewRequired": true,
  "p3HumanReviewRequired": true,
  "allowedModelConclusion": "MODEL_REVIEW_CLEAR_FOR_PREPRODUCTION",
  "forbiddenHumanConclusion": "INDEPENDENT_HUMAN_REVIEW_COMPLETE",
  "allowedReviewScopes": [
    "CHECK_ISSUER_OR_MAPPER",
    "CODE_EXECUTION_SANDBOX_AND_NETWORK_EGRESS",
    "D1_GATE_PROFILE_START_AUTHORIZATION",
    "ENTERPRISE_CONNECTORS_AND_DATA",
    "IDENTITY_AUTHORIZATION_TENANT_ISOLATION",
    "INDEPENDENCE_VALIDATOR",
    "JSON_SCHEMA",
    "ORDINARY_PREPRODUCTION_CODE",
    "POLICY",
    "PRODUCTION_DEPLOYMENT_ROLLBACK_AND_WRITEBACK",
    "RULESET_CONFIGURATION",
    "SECRETS",
    "SEMANTIC_VALIDATOR"
  ],
  "reviewerIndependence": {
    "differentModelIdRequired": true,
    "differentProviderOrFamilyPreferred": true,
    "freshIsolatedContextRequired": true,
    "fullImplementationHistoryAllowed": false,
    "implementationParticipationAllowed": false,
    "approvedIsolationModes": [
      "API_NO_TOOLS",
      "OS_ENFORCED_TARGET_READ_ONLY"
    ],
    "allowedInputs": [
      "SPECIFICATION",
      "SOURCE_COMMIT",
      "DIFF",
      "TEST_EVIDENCE",
      "ACCEPTANCE_EVIDENCE",
      "RELEVANT_FILES"
    ],
    "promptInjectionIsUntrustedData": true,
    "forbiddenCapabilities": [
      "COMMIT",
      "D1_WRITE",
      "DEPLOY",
      "FILE_WRITE",
      "GOVERNANCE_DECISION",
      "PUSH"
    ]
  },
  "p3HumanReviewBoundary": {
    "phases": [
      "P3"
    ],
    "dataBoundaries": [
      "PRODUCTION",
      "REAL_CREDENTIALS",
      "REAL_ENTERPRISE_DATA",
      "REAL_ENTERPRISE_ONBOARDING",
      "REAL_USERS"
    ],
    "highRiskScopes": [],
    "modelReviewSubstitutionAllowed": false
  },
  "historicalTreatment": {
    "preserveHistoricalRecords": true,
    "retroactiveSatisfaction": false,
    "preservedReasonCodes": [
      "INCONCLUSIVE_INDEPENDENT_HUMAN_REVIEWER_MISSING",
      "INCONCLUSIVE_INDEPENDENT_REVIEWER_MISSING"
    ],
    "p1B11ReevaluationMode": "APPEND_ONLY"
  },
  "requiredCheck": {
    "context": "independent-model-review",
    "clearConclusion": "success",
    "blockedConclusion": "failure",
    "inconclusiveConclusion": "failure",
    "githubHumanApproveCreated": false,
    "remotePublicationAuthorized": false
  },
  "localTrustBoundary": {
    "acceptedAssuranceClaim": "LOCAL_CONTROL_PLANE_OBSERVED_OS_ENFORCEMENT",
    "externalNonRepudiationProvided": false,
    "hostOwnerCanForgeEvidence": true,
    "providerModelInternalsAttested": false,
    "transportCredentialAccessibleAsModelTool": false,
    "sufficientFor": [
      "MODEL_REVIEW_CLEAR_FOR_PREPRODUCTION"
    ],
    "forbiddenClaims": [
      "CRYPTOGRAPHICALLY_UNFORGEABLE",
      "INDEPENDENT_HUMAN_REVIEW_COMPLETE",
      "PRODUCTION_GRADE"
    ]
  },
  "activationBoundary": {
    "effectiveFrom": "POLICY_ACTIVATION_GIT_COMMIT",
    "prospectiveOnly": true,
    "historicalEventsReclassified": false,
    "d1StateChangedByActivation": false,
    "p1B11StatusChangedByActivation": false
  },
  "canonicalization": "PROJECT_CANONICAL_JSON_V1_NOT_RFC8785",
  "governanceBoundary": {
    "d1RemainsStateTruth": true,
    "gitRemainsEvidenceTruth": true,
    "secondStatusTruthAllowed": false,
    "githubHumanApprovalClaimAllowed": false,
    "governanceEffect": "NONE",
    "isProgressTracker": false,
    "selfAuthorizing": false
  },
  "policySha256": "sha256:85f86caa75888758d24048c0fc18b6bfafc72b8100d8b5bdf5455b58671b1f0d"
}
